0,1,2,3,4,5,6,7,8,12,13,14,accession_number,company_name,report_period,filed_date,cik
Pool Balance,Pool Balance,Pool Balance,Pool Balance,Pool Balance,Pool Balance,,,,,,,0001788503-23-000010,CarMax Auto Owner Trust 2019-4,20230131,20230215,0001788503
1.,1.,1.,Pool Balance on the close of the last day of the preceding Collection Period,Pool Balance on the close of the last day of the preceding Collection Period,Pool Balance on the close of the last day of the preceding Collection Period,,,,$,298167738.88,,0001788503-23-000010,CarMax Auto Owner Trust 2019-4,20230131,20230215,0001788503
2.,2.,2.,Collections allocable to Principal,Collections allocable to Principal,Collections allocable to Principal,,,,$,15864213.19,,0001788503-23-000010,CarMax Auto Owner Trust 2019-4,20230131,20230215,0001788503
3.,3.,3.,Purchase Amount allocable to Principal,Purchase Amount allocable to Principal,Purchase Amount allocable to Principal,,,,$,0.00,,0001788503-23-000010,CarMax Auto Owner Trust 2019-4,20230131,20230215,0001788503
4.,4.,4.,Defaulted Receivables,Defaulted Receivables,Defaulted Receivables,,,,$,654182.93,,0001788503-23-000010,CarMax Auto Owner Trust 2019-4,20230131,20230215,0001788503
5.,5.,5.,Pool Balance on the close of the last day of the related Collection Period,Pool Balance on the close of the last day of the related Collection Period,Pool Balance on the close of the last day of the related Collection Period,,,,$,281649342.76,,0001788503-23-000010,CarMax Auto Owner Trust 2019-4,20230131,20230215,0001788503
,,,(Ln1 - Ln2 - Ln3 - Ln4),(Ln1 - Ln2 - Ln3 - Ln4),(Ln1 - Ln2 - Ln3 - Ln4),,,,,,,0001788503-23-000010,CarMax Auto Owner Trust 2019-4,20230131,20230215,0001788503
6.,6.,6.,Total number of Receivables outstanding on the close of the last day of the related Collection Period,Total number of Receivables outstanding on the close of the last day of the related Collection Period,Total number of Receivables outstanding on the close of the last day of the related Collection Period,,,,34600,34600,,0001788503-23-000010,CarMax Auto Owner Trust 2019-4,20230131,20230215,0001788503
7.,7.,7.,Initial Pool Balance,Initial Pool Balance,Initial Pool Balance,,,,$,1503750003.50,,0001788503-23-000010,CarMax Auto Owner Trust 2019-4,20230131,20230215,0001788503
,,,,,,Beginning of Period,Beginning of Period,Beginning of Period,End of Period,End of Period,End of Period,0001788503-23-000010,CarMax Auto Owner Trust 2019-4,20230131,20230215,0001788503
8.,8.,8.,Note Balances,Note Balances,Note Balances,,,,,,,0001788503-23-000010,CarMax Auto Owner Trust 2019-4,20230131,20230215,0001788503
,,,a. Class A-1 Note Balance,a. Class A-1 Note Balance,a. Class A-1 Note Balance,$,0.00,,$,0.00,,0001788503-23-000010,CarMax Auto Owner Trust 2019-4,20230131,20230215,0001788503
,,,b. Class A-2a Note Balance,b. Class A-2a Note Balance,b. Class A-2a Note Balance,$,0.00,,$,0.00,,0001788503-23-000010,CarMax Auto Owner Trust 2019-4,20230131,20230215,0001788503
,,,c. Class A-2b Floating Rate Note Balance,c. Class A-2b Floating Rate Note Balance,c. Class A-2b Floating Rate Note Balance,$,0.00,,$,0.00,,0001788503-23-000010,CarMax Auto Owner Trust 2019-4,20230131,20230215,0001788503
,,,d. Class A-3 Note Balance,d. Class A-3 Note Balance,d. Class A-3 Note Balance,$,102608363.87,,$,86089967.75,,0001788503-23-000010,CarMax Auto Owner Trust 2019-4,20230131,20230215,0001788503
,,,e. Class A-4 Note Balance,e. Class A-4 Note Balance,e. Class A-4 Note Balance,$,103820000.00,,$,103820000.00,,0001788503-23-000010,CarMax Auto Owner Trust 2019-4,20230131,20230215,0001788503
,,,f. Class B Note Balance,f. Class B Note Balance,f. Class B Note Balance,$,33840000.00,,$,33840000.00,,0001788503-23-000010,CarMax Auto Owner Trust 2019-4,20230131,20230215,0001788503
,,,g. Class C Note Balance,g. Class C Note Balance,g. Class C Note Balance,$,30070000.00,,$,30070000.00,,0001788503-23-000010,CarMax Auto Owner Trust 2019-4,20230131,20230215,0001788503
,,,h. Class D Note Balance,h. Class D Note Balance,h. Class D Note Balance,$,24070000.00,,$,24070000.00,,0001788503-23-000010,CarMax Auto Owner Trust 2019-4,20230131,20230215,0001788503
,,,i. Note Balance (sum a - h),i. Note Balance (sum a - h),i. Note Balance (sum a - h),$,294408363.87,,$,277889967.75,,0001788503-23-000010,CarMax Auto Owner Trust 2019-4,20230131,20230215,0001788503
9.,9.,9.,Pool Factors,Pool Factors,Pool Factors,,,,,,,0001788503-23-000010,CarMax Auto Owner Trust 2019-4,20230131,20230215,0001788503
,,,a. Class A-1 Note Pool Factor,a. Class A-1 Note Pool Factor,a. Class A-1 Note Pool Factor,0.0000000,0.0000000,,0.0000000,0.0000000,,0001788503-23-000010,CarMax Auto Owner Trust 2019-4,20230131,20230215,0001788503
,,,b. Class A-2a Note Pool Factor,b. Class A-2a Note Pool Factor,b. Class A-2a Note Pool Factor,0.0000000,0.0000000,,0.0000000,0.0000000,,0001788503-23-000010,CarMax Auto Owner Trust 2019-4,20230131,20230215,0001788503
,,,c. Class A-2b Floating Rate Note Pool Factor,c. Class A-2b Floating Rate Note Pool Factor,c. Class A-2b Floating Rate Note Pool Factor,0.0000000,0.0000000,,0.0000000,0.0000000,,0001788503-23-000010,CarMax Auto Owner Trust 2019-4,20230131,20230215,0001788503
,,,d. Class A-3 Note Pool Factor,d. Class A-3 Note Pool Factor,d. Class A-3 Note Pool Factor,0.2167019,0.2167019,,0.1818162,0.1818162,,0001788503-23-000010,CarMax Auto Owner Trust 2019-4,20230131,20230215,0001788503
,,,e. Class A-4 Note Pool Factor,e. Class A-4 Note Pool Factor,e. Class A-4 Note Pool Factor,1.0000000,1.0000000,,1.0000000,1.0000000,,0001788503-23-000010,CarMax Auto Owner Trust 2019-4,20230131,20230215,0001788503
,,,f. Class B Note Pool Factor,f. Class B Note Pool Factor,f. Class B Note Pool Factor,1.0000000,1.0000000,,1.0000000,1.0000000,,0001788503-23-000010,CarMax Auto Owner Trust 2019-4,20230131,20230215,0001788503
,,,g. Class C Note Pool Factor,g. Class C Note Pool Factor,g. Class C Note Pool Factor,1.0000000,1.0000000,,1.0000000,1.0000000,,0001788503-23-000010,CarMax Auto Owner Trust 2019-4,20230131,20230215,0001788503
,,,h. Class D Note Pool Factor,h. Class D Note Pool Factor,h. Class D Note Pool Factor,1.0000000,1.0000000,,1.0000000,1.0000000,,0001788503-23-000010,CarMax Auto Owner Trust 2019-4,20230131,20230215,0001788503
,,,i. Note Pool Factor,i. Note Pool Factor,i. Note Pool Factor,0.1962722,0.1962722,,0.1852600,0.1852600,,0001788503-23-000010,CarMax Auto Owner Trust 2019-4,20230131,20230215,0001788503
10.,10.,10.,Overcollateralization Target Amount,Overcollateralization Target Amount,Overcollateralization Target Amount,,,,$,3759375.01,,0001788503-23-000010,CarMax Auto Owner Trust 2019-4,20230131,20230215,0001788503
11.,11.,11.,Current overcollateralization amount (Pool Balance - Note Balance),Current overcollateralization amount (Pool Balance - Note Balance),Current overcollateralization amount (Pool Balance - Note Balance),,,,$,3759375.01,,0001788503-23-000010,CarMax Auto Owner Trust 2019-4,20230131,20230215,0001788503
12.,12.,12.,Weighted Average Coupon,Weighted Average Coupon,Weighted Average Coupon,,,,9.09,9.09,%,0001788503-23-000010,CarMax Auto Owner Trust 2019-4,20230131,20230215,0001788503
13.,13.,13.,Weighted Average Original Term,Weighted Average Original Term,Weighted Average Original Term,months,months,months,67.83,67.83,,0001788503-23-000010,CarMax Auto Owner Trust 2019-4,20230131,20230215,0001788503
14.,14.,14.,Weighted Average Remaining Term,Weighted Average Remaining Term,Weighted Average Remaining Term,months,months,months,25.94,25.94,,0001788503-23-000010,CarMax Auto Owner Trust 2019-4,20230131,20230215,0001788503
15.,15.,15.,1-Month LIBOR for the interest period ending 2/14/2023,1-Month LIBOR for the interest period ending 2/14/2023,1-Month LIBOR for the interest period ending 2/14/2023,,,,4.45443,4.45443,%,0001788503-23-000010,CarMax Auto Owner Trust 2019-4,20230131,20230215,0001788503
16.,16.,16.,Note Rate applicable to the Class A-2b notes for the interest period ending 2/14/2023,Note Rate applicable to the Class A-2b notes for the interest period ending 2/14/2023,Note Rate applicable to the Class A-2b notes for the interest period ending 2/14/2023,,,,,,,0001788503-23-000010,CarMax Auto Owner Trust 2019-4,20230131,20230215,0001788503
Collections,Collections,Collections,Collections,Collections,Collections,,,,,,,0001788503-23-000010,CarMax Auto Owner Trust 2019-4,20230131,20230215,0001788503
17.,17.,17.,Finance Charges:,Finance Charges:,Finance Charges:,,,,,,,0001788503-23-000010,CarMax Auto Owner Trust 2019-4,20230131,20230215,0001788503
,,,a. Collections allocable to Finance Charge,a. Collections allocable to Finance Charge,a. Collections allocable to Finance Charge,,,,$,2377072.53,,0001788503-23-000010,CarMax Auto Owner Trust 2019-4,20230131,20230215,0001788503
,,,b. Liquidation Proceeds allocable to Finance Charge,b. Liquidation Proceeds allocable to Finance Charge,b. Liquidation Proceeds allocable to Finance Charge,,,,$,3521.67,,0001788503-23-000010,CarMax Auto Owner Trust 2019-4,20230131,20230215,0001788503
,,,c. Purchase Amount allocable to Finance Charge,c. Purchase Amount allocable to Finance Charge,c. Purchase Amount allocable to Finance Charge,,,,$,0.00,,0001788503-23-000010,CarMax Auto Owner Trust 2019-4,20230131,20230215,0001788503
,,,d. Available Finance Charge Collections (sum a - c),d. Available Finance Charge Collections (sum a - c),d. Available Finance Charge Collections (sum a - c),,,,$,2380594.20,,0001788503-23-000010,CarMax Auto Owner Trust 2019-4,20230131,20230215,0001788503
18.,18.,18.,Principal:,Principal:,Principal:,,,,,,,0001788503-23-000010,CarMax Auto Owner Trust 2019-4,20230131,20230215,0001788503
,,,a. Collections allocable to Principal,a. Collections allocable to Principal,a. Collections allocable to Principal,,,,$,15864213.19,,0001788503-23-000010,CarMax Auto Owner Trust 2019-4,20230131,20230215,0001788503
,,,b. Liquidation Proceeds allocable to Principal,b. Liquidation Proceeds allocable to Principal,b. Liquidation Proceeds allocable to Principal,,,,$,306754.97,,0001788503-23-000010,CarMax Auto Owner Trust 2019-4,20230131,20230215,0001788503
,,,c. Purchase Amount allocable to Principal,c. Purchase Amount allocable to Principal,c. Purchase Amount allocable to Principal,,,,$,0.00,,0001788503-23-000010,CarMax Auto Owner Trust 2019-4,20230131,20230215,0001788503
,,,d. Available Principal Collections (sum a - c),d. Available Principal Collections (sum a - c),d. Available Principal Collections (sum a - c),,,,$,16170968.16,,0001788503-23-000010,CarMax Auto Owner Trust 2019-4,20230131,20230215,0001788503
19.,19.,19.,Total Finance Charge and Principal Collections (17d + 18d),Total Finance Charge and Principal Collections (17d + 18d),Total Finance Charge and Principal Collections (17d + 18d),,,,$,18551562.36,,0001788503-23-000010,CarMax Auto Owner Trust 2019-4,20230131,20230215,0001788503
20.,20.,20.,Interest Income from Collection Account,Interest Income from Collection Account,Interest Income from Collection Account,,,,$,53161.94,,0001788503-23-000010,CarMax Auto Owner Trust 2019-4,20230131,20230215,0001788503
21.,21.,21.,Simple Interest Advances,Simple Interest Advances,Simple Interest Advances,,,,$,0.00,,0001788503-23-000010,CarMax Auto Owner Trust 2019-4,20230131,20230215,0001788503
22.,22.,22.,Available Collections (Ln19 + 20 + 21),Available Collections (Ln19 + 20 + 21),Available Collections (Ln19 + 20 + 21),,,,$,18604724.30,,0001788503-23-000010,CarMax Auto Owner Trust 2019-4,20230131,20230215,0001788503
